{
  "taskId": "RF-005",
  "baseCommit": "fd75f097a160f345fdd03dbb6f4d9cbd4d3b96e9",
  "issue": "Ensure delivery jobs are created only for enabled destinations whose event-type filter includes the submitted event type. Destinations without a filter remain eligible.",
  "difficulty": "medium",
  "allowedPaths": ["packages/database/**", "packages/contracts/**", "packages/core/**"],
  "forbiddenPaths": [".agent/**", "apps/api/src/auth/**", ".github/**"],
  "verificationProfile": "database",
  "expectedBehavior": [
    "matching filtered destinations receive jobs",
    "nonmatching filtered destinations receive none",
    "unfiltered enabled destinations remain eligible"
  ],
  "evaluatorRef": "held-out:RF-005"
}
